{
  "version": 1,
  "generatedAt": "2026-07-12T21:40:34.303Z",
  "source": "ue-editor-e2e",
  "areas": {
    "bridge": {
      "accuracy": 1,
      "completeness": 1,
      "resilience": 1,
      "performance": 1,
      "verification": 1,
      "e2ePassed": true,
      "details": {
        "checks": 4,
        "passed": 4
      }
    },
    "ci": {
      "accuracy": 1,
      "completeness": 1,
      "resilience": 1,
      "performance": 1,
      "verification": 1,
      "e2ePassed": true
    }
  }
}
