{
  "version": 1,
  "generatedAt": "2026-07-12T21:58:55.575Z",
  "source": "ci-merge",
  "areas": {
    "trust": {
      "accuracy": 0.85,
      "completeness": 0.7,
      "resilience": 0.8,
      "performance": 0.75,
      "verification": 0.9,
      "e2ePassed": true,
      "details": {
        "bridgeContractTests": true,
        "noFalsePassContract": true
      }
    },
    "schemas": {
      "accuracy": 0.8,
      "completeness": 0.75,
      "resilience": 0.7,
      "performance": 0.8,
      "verification": 0.85,
      "e2ePassed": true,
      "details": {
        "editorBridgeSchema": true
      }
    },
    "buildSnapshot": {
      "accuracy": 0.78,
      "completeness": 0.75,
      "resilience": 0.72,
      "performance": 0.74,
      "verification": 0.82,
      "e2ePassed": true,
      "details": {
        "buildSnapshotV3": true,
        "rspMerkle": true,
        "inputsRevalidate": true
      }
    },
    "bridge": {
      "accuracy": 1,
      "completeness": 1,
      "resilience": 1,
      "performance": 1,
      "verification": 1,
      "e2ePassed": true,
      "details": {
        "checks": 4,
        "passed": 4
      }
    },
    "semantic": {
      "accuracy": 0.55,
      "completeness": 0.5,
      "resilience": 0.52,
      "performance": 0.58,
      "verification": 0.55,
      "e2ePassed": false,
      "details": {
        "clangdDelegation": true,
        "ueOverlayFirst": true
      }
    },
    "uht": {
      "accuracy": 0.62,
      "completeness": 0.58,
      "resilience": 0.6,
      "performance": 0.62,
      "verification": 0.72,
      "e2ePassed": true,
      "details": {
        "inspectionsCorpus200": true,
        "cacheMergeFixed": true,
        "braceScanner": true
      }
    },
    "testing": {
      "accuracy": 0.58,
      "completeness": 0.55,
      "resilience": 0.52,
      "performance": 0.55,
      "verification": 0.6,
      "e2ePassed": false,
      "details": {
        "automationCompletionTicker": true,
        "executionId": true
      }
    },
    "workflow": {
      "accuracy": 0.65,
      "completeness": 0.6,
      "resilience": 0.58,
      "performance": 0.55,
      "verification": 0.62,
      "e2ePassed": false,
      "details": {
        "testExplorerUri": true,
        "serverTarget": true,
        "logCursor": true,
        "hlslOverlay": true
      }
    },
    "projectRuntime": {
      "accuracy": 0.62,
      "completeness": 0.58,
      "resilience": 0.55,
      "performance": 0.58,
      "verification": 0.6,
      "e2ePassed": false,
      "details": {
        "registryWired": true,
        "uriResolution": true,
        "folderDispose": true
      }
    },
    "ci": {
      "accuracy": 1,
      "completeness": 1,
      "resilience": 1,
      "performance": 1,
      "verification": 1,
      "e2ePassed": true,
      "details": {
        "artifactBasedScorecard": true,
        "verifyStructureSplit": true,
        "ueE2eOnSelfHosted": true,
        "forkPrBuildIndependent": true
      }
    }
  }
}
